{
  "schema": "dev.woia.plugin-overlay/v1",
  "id": "project-copy-preferences",
  "revision": 1,
  "plugin": "woia-marketing-content-copy",
  "scope": "project",
  "directives": {
    "instructions": [
      "Use the organization's approved closing phrase when the channel permits it."
    ],
    "preferences": {
      "tone": "professional-friendly"
    }
  },
  "resources": [],
  "compatibility": {
    "last_validated_base": "0.5.0",
    "status": "compatible",
    "conflicts": []
  },
  "source_improvement_refs": []
}
